key,name,comment,inherits_from,granted_to,warehouse,is_active
revops_analyst,REVOPS_ANALYST,Read MARTS only,,,ANALYTICS,true
revops_developer,REVOPS_DEVELOPER,Read/write RAW + STAGING + MARTS (all envs); the role dbt jobs use to build models incl. PROD,REVOPS_ANALYST,,TRANSFORM,true
revops_admin,REVOPS_ADMIN,Full domain access; only role that sees unmasked ARR,REVOPS_DEVELOPER,SYSADMIN,TRANSFORM,true
revops_ingestion_adls,REVOPS_INGESTION_ADLS,Write RAW telemetry (PRODUCT_EVENTS_RAW_ADLS) - Python/ADLS loader,,SYSADMIN,INGEST,true
revops_ingestion_fivetran,REVOPS_INGESTION_FIVETRAN,All privileges on tables+views in RAW Salesforce (SALESFORCE_RAW_FIVETRAN) - Fivetran connector,,SYSADMIN,INGEST,true
