key,name,comment,inherits_from,granted_to,warehouse,human_assignable,is_active
revops_analyst,REVOPS_ANALYST,Read MARTS only,,,ANALYTICS,true,true
revops_reader,REVOPS_READER,Read all schemas but NOT sensitive financials (sibling of ANALYST - does NOT inherit it),,,ANALYTICS,true,true
revops_developer,REVOPS_DEVELOPER,Read/write RAW + STAGING + MARTS (all envs); SERVICE-ONLY - dbt role incl PROD; inherits READER (read-all) + ANALYST (financial-exempt),REVOPS_READER|REVOPS_ANALYST,,TRANSFORM,false,true
revops_admin,REVOPS_ADMIN,Full domain access; only role that sees unmasked ARR,REVOPS_DEVELOPER,SYSADMIN,TRANSFORM,true,true
revops_ingestion_adls,REVOPS_INGESTION_ADLS,Write RAW telemetry (PRODUCT_EVENTS_RAW_ADLS) - Python/ADLS loader; service-only,,SYSADMIN,INGEST,false,true
revops_ingestion_fivetran,REVOPS_INGESTION_FIVETRAN,All privileges on tables+views in RAW Salesforce (SALESFORCE_RAW_FIVETRAN) - Fivetran connector; service-only,,SYSADMIN,INGEST,false,true
